{
  "schema_version": "1.0",
  "event_id": "81400000-0000-4000-8000-000000000004",
  "event_type": "forecast.baseline.ready.v1",
  "occurred_at": "2026-08-25T10:20:02Z",
  "run_id": "a78aa324-0832-59e1-b9ea-d97933b2821e",
  "job_id": "81400000-0000-4000-8000-000000000002",
  "trace_id": "81400000-0000-4000-8000-000000000003",
  "payload": {
    "forecast_uri": "s3://rainpulse/products/a78aa324-0832-59e1-b9ea-d97933b2821e/pysteps-lk/pysteps-lk-1.1.0/forecast.zarr",
    "issue_time": "2026-08-25T10:00:00Z",
    "grid_id": "fuzhou_118_123_25_27_0p01deg_v1",
    "model_id": "pysteps-lk",
    "model_version": "pysteps-lk-1.1.0",
    "config_version": "rp016-pysteps-lk-v1",
    "lead_count": 30,
    "lead_step_minutes": 6,
    "valid_from": "2026-08-25T10:05:00Z",
    "valid_to": "2026-08-25T12:00:00Z"
  }
}
